{
  "manifest": {
    "contractVersion": "0.4.0",
    "publicationId": "contract-golden-empty",
    "datasetVersion": "0.0.0",
    "title": "0.4 契约最小金标准发布包",
    "generatedAt": "1970-01-01T00:00:00.000Z",
    "contentChecksum": "sha256:0000000000000000000000000000000000000000000000000000000000000000",
    "sourceDescription": "仅用于跨语言结构契约一致性测试"
  },
  "sources": [],
  "works": [],
  "editions": [],
  "volumes": [],
  "facsimilePages": [],
  "passages": [],
  "entities": [],
  "mentions": [],
  "assertions": [],
  "places": [],
  "geometries": [],
  "occurrences": []
}
